"Index","Line Number","Text"
"1","1","AUGMENTING HUMAN INTELLECT: A Conceptual Framework.<br />By"
"1","2","Douglas C. Engelbart.<br />October 1962."
"1.1","1","I. INTRODUCTION"
"1.1.1","1","A. GENERAL"
"1.1.1.1","1","By &quot;augmenting human intellect&quot; we mean increasing the"
"1.1.1.1","2","capability of a man to approach a complex problem situation, to"
"1.1.1.1","3","gain comprehension to suit his particular needs, and to derive"
"1.1.1.1","4","solutions to problems. Increased capability in this respect is"
"1.1.1.1","5","taken to mean a mixture of the following: more-rapid"
"1.1.1.1","6","comprehension, better comprehension, the possibility of gaining"
"1.1.1.1","7","a useful degree of comprehension in a situation that previously"
"1.1.1.1","8","was too complex, speedier solutions, better solutions, and the"
"1.1.1.1","9","possibility of finding solutions to problems that before seemed"
"1.1.1.1","10","insoluble. And by &quot;complex situations&quot; we include the"
"1.1.1.1","11","professional problems of diplomats, executives, social"
"1.1.1.1","12","scientists, life scientists, physical scientists, attorneys,"
"1.1.1.1","13","designers--whether the problem situation exists for twenty"
"1.1.1.1","14","minutes or twenty years. We do not speak of isolated clever"
"1.1.1.1","15","tricks that help in particular situations.  We refer to a way of"
"1.1.1.1","16","life in an integrated domain where hunches, cut-and-try,"
"1.1.1.1","17","intangibles, and the human &quot;feel for a situation&quot;"
"1.1.1.1","18","usefully co-exist with powerful concepts, streamlined"
"1.1.1.1","19","terminology and notation, sophisticated methods, and high-"
"1.1.1.1","20","powered electronic aids."
"1.1.1.2","1","Man's population and gross product are increasing at a"
"1.1.1.2","2","considerable rate, but the <i>complexity</i> of his problems"
"1.1.1.2","3","grows still faster, and the <i>urgency</i> with which solutions"
"1.1.1.2","4","must be found becomes steadily greater in response to the"
"1.1.1.2","5","increased rate of activity and the increasingly global nature of"
"1.1.1.2","6","that activity. Augmenting man's intellect, in the sense defined"
"1.1.1.2","7","above, would warrant full pursuit by an enlightened society if"
"1.1.1.2","8","there could be shown a reasonable approach and some plausible"
"1.1.1.2","9","benefits."
"1.1.1.3","1","This report covers the first phase of a program aimed at"
"1.1.1.3","2","developing means to augment the human intellect. These"
"1.1.1.3","3","&quot;means&quot; can include many things--all of which appear"
"1.1.1.3","4","to be but extensions of means developed andused in the past to"
"1.1.1.3","5","help man apply his native sensory, mental, and motor"
"1.1.1.3","6","capabilities--and we consider the whole system of a human and"
"1.1.1.3","7","his augmentation means as a proper field of search for practical"
"1.1.1.3","8","possibilities. It is a very important system to our society, and"
"1.1.1.3","9","like most systems its performance can best be improved by"
"1.1.1.3","10","considering the whole as a set of interacting components rather"
"1.1.1.3","11","than by considering the components in isolation."
"1.1.1.4","1","This kind of system approach to human intellectual effectiveness"
"1.1.1.4","2","does not find a ready-made conceptual framework such as exists"
"1.1.1.4","3","for established disciplines. Before a research program can be"
"1.1.1.4","4","designed to pursue such an approach intelligently, so that"
"1.1.1.4","5","practical benefits might be derived within a reasonable time"
"1.1.1.4","6","while also producing results of longrange significance, a"
"1.1.1.4","7","conceptual framework must be searched out--a framework that"
"1.1.1.4","8","provides orientation as to the important factors of the system,"
"1.1.1.4","9","the relationships among these factors, the types of change among"
"1.1.1.4","10","the system factors that offer likely improvements in"
"1.1.1.4","11","performance, and the sort of research goals and methodology that"
"1.1.1.4","12","seem promising.<a href=&quot;#Notes-1-1&quot;>1</a>"
"1.1.1.5","1","In the first (search) phase of our program we have developed a"
"1.1.1.5","2","conceptual framework that seems satisfactory for the current"
"1.1.1.5","3","needs of designing a research phase. Section II contains the"
"1.1.1.5","4","essence of this framework as derived from several different ways"
"1.1.1.5","5","of looking at the system made up of a human and his intellect-"
"1.1.1.5","6","augmentation means."
"1.1.1.6","1","The process of developing this conceptual framework brought out"
"1.1.1.6","2","a number of significant realizations: that the intellectual"
"1.1.1.6","3","effectiveness exercised today by a given human has little"
"1.1.1.6","4","likelihood of being intelligence limited--that there are dozens"
"1.1.1.6","5","of disciplines in engineering, mathematics, and the social,"
"1.1.1.6","6","life, and physical sciences that can contribute improvements to"
"1.1.1.6","7","the system of intellect-augmentation means; that any one such"
"1.1.1.6","8","improvement can be expected to trigger a chain of"
"1.1.1.6","9","coordinatingimprovements; that until every one of these"
"1.1.1.6","10","disciplines comes to a standstill and we have exhausted all the"
"1.1.1.6","11","improvement possibilities we could glean from it, we can expect"
"1.1.1.6","12","to continue to develop improvements in this human-intellect"
"1.1.1.6","13","system; that there is no particular reason not to expect gains"
"1.1.1.6","14","in personal intellectual effectiveness from a concerted"
"1.1.1.6","15","systemoriented approach that compare to those made in personal"
"1.1.1.6","16","geographic mobility since horseback and sailboat days."
"1.1.1.7","1","The picture of how one can view the possibilities for a"
"1.1.1.7","2","systematic approach to increasing human intellectual"
"1.1.1.7","3","effectiveness, as put forth in Section II in the sober and"
"1.1.1.7","4","general terms of an initial basic analysis, does not seem to"
"1.1.1.7","5","convey all of the richness and promise that was stimulated by"
"1.1.1.7","6","the development of that picture. Consequently, Section III is"
"1.1.1.7","7","intended to present some definite images that illustrate"
"1.1.1.7","8","meaningful possibilities deriveable from the conceptual"
"1.1.1.7","9","framework presented in Section II--and in a rather marked"
"1.1.1.7","10","deviation from ordinary technical writing, a good portion of"
"1.1.1.7","11","Section III presents these images in a fiction-dialogue style as"
"1.1.1.7","12","a mechanism for transmitting a feeling for the richness and"
"1.1.1.7","13","promise of the possibilities in one region of the improvement"
"1.1.1.7","14","space&quot; that is roughly mapped in Section II."
"1.1.1.8","1","The style of Section III seems to make for easier reading. If"
"1.1.1.8","2","Section II begins to seem unrewardingly difficult, the reader"
"1.1.1.8","3","may find it helpful to skip from Section II-B directly to"
"1.1.1.8","4","Section III. If it serves its purpose well enough, Section III"
"1.1.1.8","5","will provide a context within which the reader can go back and"
"1.1.1.8","6","finish Section II with less effort."
"1.1.1.9","1","In Section IV (Research Recommendations) we present a general"
"1.1.1.9","2","strategy for pursuing research toward increasing human"
"1.1.1.9","3","intellectual effectiveness.  This strategy evolved directly from"
"1.1.1.9","4","the concepts presented in Sections II and III; one of its"
"1.1.1.9","5","important precepts is to pursue the quickest gains first, and"
"1.1.1.9","6","use the increased intellectual effectiveness thus derived to"
"1.1.1.9","7","help pursue successive gains. We see the quickest gains emerging"
"1.1.1.9","8","from (1) giving the human the minute-by-minute services of a"
"1.1.1.9","9","digital computer equipped with computer-driven cathode-ray-tube"
"1.1.1.9","10","display, and (2) developing the new methods of thinking and"
"1.1.1.9","11","working that allow the human to capitalizeupon the computer's"
"1.1.1.9","12","help. By this same strategy, we recommend that an initial"
"1.1.1.9","13","research effort develop a prototype system of this sort aimed at"
"1.1.1.9","14","increasing human effectiveness in the task of computer"
"1.1.1.9","15","programming."
"1.1.1.10","1","To give the reader an initial orientation about what sort of"
"1.1.1.10","2","thing this computer-aided working system might be, we include"
"1.1.1.10","3","below a short description of a possible system of this sort."
"1.1.1.10","4","This illustrative example is not to be considered a description"
"1.1.1.10","5","of the actual system that will emerge from the program. It is"
"1.1.1.10","6","given only to show the general direction of the work, and is"
"1.1.1.10","7","clothed in fiction only to make it easier to visualize."
"1.1.1.11","1","Let us consider an augmented architect at work. He sits at a"
"1.1.1.11","2","working station that has a visual display screen some three feet"
"1.1.1.11","3","on a side; this is his working surface, and is controlled by a"
"1.1.1.11","4","computer (his &quot;clerk&quot; ) with which he can communicate"
"1.1.1.11","5","by means of a small keyboard and various other devices."
"1.1.1.12","1","He is designing a building. He has already dreamed up several"
"1.1.1.12","2","basic layouts and structural forms, and is trying them out on"
"1.1.1.12","3","the screen. The surveying data for the layout he is working on"
"1.1.1.12","4","now have already been entered, and he has just coaxed the clerk"
"1.1.1.12","5","to show him a perspective view of the steep hillside building"
"1.1.1.12","6","site with the roadway above, symbolic representations of the"
"1.1.1.12","7","various trees that are to remain on the lot, and the service tie"
"1.1.1.12","8","points for the different utilities. The view occupies the left"
"1.1.1.12","9","two-thirds of the screen. With a &quot;pointer,&quot; he"
"1.1.1.12","10","indicates two points of interest, moves his left hand rapidly"
"1.1.1.12","11","over the keyboard, and the distance and elevation between the"
"1.1.1.12","12","points indicated appear on the right- hand third of the screen."
"1.1.1.13","1","Now he enters a reference line with his pointer, and the"
"1.1.1.13","2","keyboard. Gradually the screen begins to show the work he is"
"1.1.1.13","3","doing--a neat excavation appears in the hillside) revises itself"
"1.1.1.13","4","slightly, and revises itself again. After a moment, the"
"1.1.1.13","5","architect changes the scene on the screen to an overhead plan"
"1.1.1.13","6","view of the site, still showing the excavation. A few minutes of"
"1.1.1.13","7","study, and he enters on the keyboard a list of items, checking"
"1.1.1.13","8","each one as it appears on the screen, to be studied later."
"1.1.1.14","1","Ignoring the representation on the display, the architect next"
"1.1.1.14","2","begins to enter a series of specifications and data--a six-inch"
"1.1.1.14","3","slab floor, twelve-inch concrete walls eight feet high within"
"1.1.1.14","4","the excavation, and so on. When he has finished, the revised"
"1.1.1.14","5","scene appears on the screen. A structure is taking shape. He"
"1.1.1.14","6","examines it, adjusts it, pauses long enough to ask for handbook"
"1.1.1.14","7","or catalog information from the clerk at various points, and"
"1.1.1.14","8","reacijusts accordingly. He often recalls from the"
"1.1.1.14","9","&quot;clerk&quot; his working lists of specifications and"
"1.1.1.14","10","considerations to refer to them, modify them, or add to them."
"1.1.1.14","11","These lists grow into an evermore-detailed, interlinked"
"1.1.1.14","12","structure, which represents the maturing thought behind the"
"1.1.1.14","13","actual design."
"1.1.1.15","1","Prescribing different planes here and there, curved surfaces"
"1.1.1.15","2","occasionally, and moving the whole structure about five feet, he"
"1.1.1.15","3","finally has the rough external form of the building balanced"
"1.1.1.15","4","nicely with the setting and he is assured that this form is"
"1.1.1.15","5","basically compatible with the materials to be used as well as"
"1.1.1.15","6","with the function of the building."
"1.1.1.16","1","Now he begins to enter detailed information about the interior."
"1.1.1.16","2","Here the capability of the clerk to show him any view he wants"
"1.1.1.16","3","to examine (a slice of the interior, or how the structure would"
"1.1.1.16","4","look from the roadway above) is important. He enters particular"
"1.1.1.16","5","fixture designs, and examines them in a particular room. He"
"1.1.1.16","6","checks to make sure that sun glare from the windows will not"
"1.1.1.16","7","blind a driver on the roadway, and the &quot;clerk&quot;"
"1.1.1.16","8","computes the information that one window will reflect strongly"
"1.1.1.16","9","onto the roadway between 6 and 6:30 on midsummer mornings."
"1.1.1.17","1","Next he begins a functional analysis. He has a list of the"
"1.1.1.17","2","people who will occupy this building, and the daily sequences of"
"1.1.1.17","3","their activtites.  The &quot;clerk&quot; allows him to follow"
"1.1.1.17","4","each in turn, examining how doors swing, where special lighting"
"1.1.1.17","5","might be needed. Finally he has the &quot;clerk&quot; combine"
"1.1.1.17","6","all of these sequences of activity to indicate spots where"
"1.1.1.17","7","traffic is heavy in the building, or where congestion might"
"1.1.1.17","8","occur, and to determine what the severest drain on the utilities"
"1.1.1.17","9","is likely to be."
"1.1.1.18","1","All of this information (the building design and its associated"
"1.1.1.18","2","&quot;thought structure&quot;) can be stored on a tape to"
"1.1.1.18","3","represent the design manual for the building. Loading this tape"
"1.1.1.18","4","into his own clerk, another architect, a builder, or the client"
"1.1.1.18","5","can maneuver within this design manual to pursue whatever"
"1.1.1.18","6","details or insights are of interest to him--and can append"
"1.1.1.18","7","special notes that are integrated into the design manual for his"
"1.1.1.18","8","own or someone else's later benefit."
"1.1.1.19","1","In such a future working relationship between human problem-"
"1.1.1.19","2","solver and computer 'clerk,' the capability of the computer for"
"1.1.1.19","3","executing mathematical processes would be used whenever it was"
"1.1.1.19","4","needed. However, the computer has many other capabilities for"
"1.1.1.19","5","manipulating and displaying information that can be of"
"1.1.1.19","6","significant benefit to the human in nonmathematical processes of"
"1.1.1.19","7","planning, organizing, studying, etc. Every person who does his"
"1.1.1.19","8","thinking with symbolized concepts (whether in the form of the"
"1.1.1.19","9","English language, pictographs, formal logic, or mathematics)"
"1.1.1.19","10","should be able to benefit significantly."
"1.1.2","1","B. OBJECTIVE OF THE STUDY"
"1.1.2.1","1","The objective of this study is to develop a conceptual framework"
"1.1.2.1","2","within which could grow a coordinated research and development"
"1.1.2.1","3","program whose goals would be the following: (1) to find the"
"1.1.2.1","4","factors that limit the effectiveness of the individual's basic"
"1.1.2.1","5","information-handling capabilities in meeting the various needs"
"1.1.2.1","6","of society for problem solving in its most general sense; and"
"1.1.2.1","7","(2) to develop new techniques, procedures, and systems that will"
"1.1.2.1","8","better match these basic capabilities to the needs' problems,"
"1.1.2.1","9","and progress of society. We have placed the following"
"1.1.2.1","10","specifications on this framework:"
"1.1.2.1.1","1","1. That it provide perspective for both long-range basic"
"1.1.2.1.1","2","research and research that will yield practical results soon."
"1.1.2.1.2","1","2. That it indicate what this augmentation will actually involve"
"1.1.2.1.2","2","in the way of changes in working environment, in thinking, in"
"1.1.2.1.2","3","skills, and in methods of working."
"1.1.2.1.3","1","3. That it be a basis for evaluating the possible relevance of"
"1.1.2.1.3","2","work and knowledge from existing fields and for assimilating"
"1.1.2.1.3","3","whatever is relevant."
"1.1.2.1.4","1","4. That it reveal areas where research is possible and ways to"
"1.1.2.1.4","2","assess the research, be a basis for choosing starting points,"
"1.1.2.1.4","3","and indicate how to develop appropriate methodologies for the"
"1.1.2.1.4","4","needed research."
"1.1.2.2","1","Two points need emphasis here. First, although a conceptual"
"1.1.2.2","2","framework has been constructed, it is still rudimentary. Further"
"1.1.2.2","3","search, and actual research, are needed for the evolution of the"
"1.1.2.2","4","framework. Second, even if our conceptual framework did provide"
"1.1.2.2","5","an accurate and complete basic analysis of the system from which"
"1.1.2.2","6","stems a human's intellectual effectiveness, the explicit nature"
"1.1.2.2","7","of future improved systems would be highly affected by"
"1.1.2.2","8","(expected) changes in our technology or in our understanding of"
"1.1.2.2","9","the human being."
"1.2","1","II. CONCEPTUAL FRAMEWORK"
"1.2.1","1","A. GENERAL"
"1.2.1.1","1","The conceptual framework we seek must orient us toward the real"
"1.2.1.1","2","possibilities and problems associated with using modern"
"1.2.1.1","3","technology to give direct aid to an individual in comprehending"
"1.2.1.1","4","complex situations, isolating the significant factors, and"
"1.2.1.1","5","solving problems. To gain this orientation, we examine how"
"1.2.1.1","6","individuals achieve their present level of effectiveness, and"
"1.2.1.1","7","expect that this examination will reveal possibilities for"
"1.2.1.1","8","improvement."
"1.2.1.2","1","The entire effect of an individual on the world stems"
"1.2.1.2","2","essentially from what he can transmit to the world through his"
"1.2.1.2","3","limited motor channels. This in turn is based on information"
"1.2.1.2","4","received from the outside world through limited sensory"
"1.2.1.2","5","channels; on information, drives, and needs generated within"
"1.2.1.2","6","him; and on his processing of that information. His processing"
"1.2.1.2","7","is of two kinds: that which he is generally conscious of"
"1.2.1.2","8","(recognizing patterns, remembering, visualizing, abstracting,"
"1.2.1.2","9","deducing, inducing, etc.), and that involving the unconscious"
"1.2.1.2","10","processing and mediating of received and self-generated"
"1.2.1.2","11","information, and the unconscious mediating of conscious"
"1.2.1.2","12","processing itself."
"1.2.1.3","1","The individual does not use this information and this processing"
"1.2.1.3","2","to grapple directly with the sort of complex situation in which"
"1.2.1.3","3","we seek to give him help. He uses his innate capabilities in a"
"1.2.1.3","4","rather more indirect fashion, since the situation is generally"
"1.2.1.3","5","too complex to yield directly to his motor actions, and always"
"1.2.1.3","6","too complex to yield comprehensions and solutions from direct"
"1.2.1.3","7","sensory inspection and use of basic cognitive capabilities. For"
"1.2.1.3","8","instance, an aborigine who possesses all of our basic sensory-"
"1.2.1.3","9","mental-motor capabilities, but does not possess our background"
"1.2.1.3","10","of indirect knowledge and procedure, cannot organize the proper"
"1.2.1.3","11","direct actions necessary to drive a car through traffic, request"
"1.2.1.3","12","a book from the library, call a committee meeting to discuss a"
"1.2.1.3","13","tentative plan, call someone on the telephone, or compose a"
"1.2.1.3","14","letter on the typewriter."
"1.2.1.4","1","Our culture has evolved means for us to organize the little"
"1.2.1.4","2","things we can do with our <i>basic</i> capabilities so that we"
"1.2.1.4","3","can derive comprehension from truly complex situations, and"
"1.2.1.4","4","accomplish the processes of deriving and implementing problem"
"1.2.1.4","5","solutions. The ways in which human capabilities are thus"
"1.2.1.4","6","extended are here called augmentation means, and we define four"
"1.2.1.4","7","basic classes of them:"
"1.2.1.4.1","1","1. <i>Artifacts</i>--physical objects designed to provide for"
"1.2.1.4.1","2","human comfort, for the manipulation of things or materials, and"
"1.2.1.4.1","3","for the manipulation of symbols."
"1.2.1.4.2","1","2. <i>Language</i>--the way in which the individual parcels out"
"1.2.1.4.2","2","the picture of his world into the concepts that his mind uses to"
"1.2.1.4.2","3","model that world, and the symbols that he attaches to those"
"1.2.1.4.2","4","concepts and uses in consciously manipulating the concepts"
"1.2.1.4.2","5","(&quot;thinking&quot;)."
"1.2.1.4.3","1","3. <i>Methodology</i>--the methods, procedures, strategies,"
"1.2.1.4.3","2","etc., with which an individual organizes his <i>goal-"
"1.2.1.4.3","3","centered</i> (problem-solving) activity."
"1.2.1.4.4","1","4. <i>Training</i>--the conditioning needed by the human being"
"1.2.1.4.4","2","to bring his skills in using Means 1, 2, and 3 to the point"
"1.2.1.4.4","3","where they are operationally effective."
"1.2.1.5","1","The system we want to improve can thus be visualized as a"
"1.2.1.5","2","trained human being together with his artifacts, language, and"
"1.2.1.5","3","methodology. The explicit new system we contemplate will involve"
"1.2.1.5","4","as artifacts computers, and computer-controlled information-"
"1.2.1.5","5","storage, information-handling, and information-display devices."
"1.2.1.5","6","The aspects of the conceptual framework that are discussed here"
"1.2.1.5","7","are primarily those relating to the human being's ability to"
"1.2.1.5","8","make significant use of such equipment in an integrated system."
"1.2.1.6","1","Pervading all of the augmentation means is a particular"
"1.2.1.6","2","structure or organization. While an untrained aborigine cannot"
"1.2.1.6","3","drive a car through traffic, because he cannot leap the gap"
"1.2.1.6","4","between his cultural background and the kind of world that"
"1.2.1.6","5","contains cars and traffic, it is possible to move step by step"
"1.2.1.6","6","through an organized training program that will enable him to"
"1.2.1.6","7","drive effectively and safely. In other words, the human mind"
"1.2.1.6","8","neither learns nor acts by large leaps, but by steps organized"
"1.2.1.6","9","or structured so that each one depends upon previous steps."
"1.2.1.7","1","Although the size of the step a human being can take in"
"1.2.1.7","2","comprehension, innovation, or execution is small in comparison"
"1.2.1.7","3","to the over-all size of the step needed to solve a complex"
"1.2.1.7","4","problem, human beings nevertheless do solve complex problems. It"
"1.2.1.7","5","is the augmentation means that serve to break down a large"
"1.2.1.7","6","problem in such a way that the human being can walk through it"
"1.2.1.7","7","with his little steps, and it is the structure or organization"
"1.2.1.7","8","of these little steps or actions that we discuss as <i>process"
"1.2.1.7","9","hierarchies</i>."
"1.2.1.8","1","Every process of thought or action is made up of sub-processes."
"1.2.1.8","2","Let us consider such examples as making a pencil stroke, writing"
"1.2.1.8","3","a letter of the alphabet, or making a plan. Quite a few discrete"
"1.2.1.8","4","muscle movements are organized into the making of a pencil"
"1.2.1.8","5","stroke; similarly, making particular pencil strokes and making a"
"1.2.1.8","6","plan for a letter are complex processes in themselves that"
"1.2.1.8","7","become sub-processes to the over-all writing of an alphabetic"
"1.2.1.8","8","character."
"1.2.1.9","1","Although every sub-process is a process in its own right, in"
"1.2.1.9","2","that it consists of further sub-processes, there seems to be no"
"1.2.1.9","3","point here in looking for the ultimate bottom of the process-"
"1.2.1.9","4","hierarchical structure. There seems to be no way of telling"
"1.2.1.9","5","whether or not the apparent bottoms (processes that cannot be"
"1.2.1.9","6","further subdivided) exist in the physical world or in the"
"1.2.1.9","7","limitations of human understanding."
"1.2.1.10","1","In any case, it is not necessary to begin from the bottom in"
"1.2.1.10","2","discussing particular process hierarchies. No person uses a"
"1.2.1.10","3","process that is completely unique every time he tackles"
"1.2.1.10","4","something new. Instead, he begins from a group of basic sensory-"
"1.2.1.10","5","mental-motor process capabilities, and adds to these certain of"
"1.2.1.10","6","the process capabilities of his artifacts. There are only a"
"1.2.1.10","7","finite number of such basic human and artifact capabilities from"
"1.2.1.10","8","which to draw. Furthermore, even quite different higher order"
"1.2.1.10","9","processes may have in common relatively high-order sub-"
"1.2.1.10","10","processes&quot;."
"1.2.1.11","1","When a man writes prose text (a reasonably high-order process),"
"1.2.1.11","2","he makes use of many processes as sub-processes that are common"
"1.2.1.11","3","to other high-order processes. For example, he makes use of"
"1.2.1.11","4","planning, composing, dictating.  The process of writing is"
"1.2.1.11","5","utilized as a sub-process within many different processes of a"
