"Index","Line Number","Text"
"1.3.1.8.20","11","sophisticated capabilities to become   available within the next"
"1.3.1.8.20","12","ten years.  Such equipment may play   an important role in the"
"1.3.1.8.20","13","individual-augmentation systems of   the future (but our feeling"
"1.3.1.8.20","14","is that a very powerful   augmentation system can be developed"
"1.3.1.8.20","15","without them)."
"1.3.1.8.21","1","An important type of development for   our consideration of"
"1.3.1.8.21","2","providing individual humans with   close-coupled computer"
"1.3.1.8.21","3","services is what is known as time   sharing. Suppose a number of"
"1.3.1.8.21","4","individual users connect to the   same computer The computer can"
"1.3.1.8.21","5","be programmed to serve them   under any of a wide variety of"
"1.3.1.8.21","6","rules. One such could be   similar to the way the telephone"
"1.3.1.8.21","7","system gives you attention   and service when you ask for it--"
"1.3.1.8.21","8","i.e., if too many other   demands are not being made for service"
"1.3.1.8.21","9","at that time, you get   instant attention; otherwise, you wait"
"1.3.1.8.21","10","until some service   capacity is free to attend to you."
"1.3.1.8.22","1","Our view of the interaction of human   and computer in the"
"1.3.1.8.22","2","future augmented system sees a large   number of relatlvely"
"1.3.1.8.22","3","simple processes (human scale of large   and simple) being"
"1.3.1.8.22","4","performed by the computer for the   human--processes which often"
"1.3.1.8.22","5","will require only a few   thousandths of a second of actual"
"1.3.1.8.22","6","computer manipulation. Such   a fast and agile helper as a"
"1.3.1.8.22","7","computer can run around between a   number of masters and seldom"
"1.3.1.8.22","8","keep any of them waiting (at   least, not long enough that they"
"1.3.1.8.22","9","would notice it or be   inconvenienced appreciably)."
"1.3.1.8.22","10","Occasionally, of course, much   larger periods of computer time"
"1.3.1.8.22","11","will be needed by an   individual, and then the other users"
"1.3.1.8.22","12","might get their periodic   milliseconds of service slipped in"
"1.3.1.8.22","13","during these longer   processes."
"1.3.1.9","1","5. Other Related Thought and Work"
"1.3.1.9.1","1","When we began our search, we found a   great deal of literature"
"1.3.1.9.1","2","which put forth thought and work of   general significance to"
"1.3.1.9.1","3","our objective-- frankly, too   much. Without having a conceptual"
"1.3.1.9.1","4","framework, we could not   efficiently filter out the significant"
"1.3.1.9.1","5","kernels of fact and   concept from the huge mass which we"
"1.3.1.9.1","6","initially collected as a   &quot;natural first step&quot; in our"
"1.3.1.9.1","7","search. We feel rather unscholarly   not to buttress our"
"1.3.1.9.1","8","conceptual framework with plentiful   reference to supporting"
"1.3.1.9.1","9","work, but in truth it was too   difficult to do. Developing the"
"1.3.1.9.1","10","conceptual structure   represented a sweeping synthesis job full"
"1.3.1.9.1","11","of personal   constructs from smatterings picked up in many"
"1.3.1.9.1","12","places.  Under   these conditions, giving reference to a backup"
"1.3.1.9.1","13","source would   usually entail qualifying footnotes reflecting an"
"1.3.1.9.1","14","unusual   interpretation or exonerating the other author from"
"1.3.1.9.1","15","the   implications we derived from his work. We look forward to"
"1.3.1.9.1","16","a   stronger, more comprehensive, and more scholarly"
"1.3.1.9.1","17","presentation   evolving out of future work."
"1.3.1.9.2","1","However, we do want to acknowledge thoughts and work we have"
"1.3.1.9.2","2","come across that bear most directly upon the possibilities of"
"1.3.1.9.2","3","using a computer in real-time   working association with a human"
"1.3.1.9.2","4","to improve his working   effectiveness.  These fall into two"
"1.3.1.9.2","5","categories. The first category, which would include this report,"
"1.3.1.9.2","6","presents speculations and possibilities but does not include"
"1.3.1.9.2","7","reporting of significant experimental results. Of these, Bush"
"1.3.1.9.2","8","(<a href=&quot;#Ref-6&quot;>6</a>) is the earliest and one of"
"1.3.1.9.2","9","the most   directly stimulating. Licklider (<a"
"1.3.1.9.2","10","href=&quot;#Ref-15&quot;>15</a>) provided the most general clear"
"1.3.1.9.2","11","case for the modern computer, and coined the expression,"
"1.3.1.9.2","12","&quot;man-computer symbiosis&quot; to refer to the close"
"1.3.1.9.2","13","interaction   relationship between the man and computer in"
"1.3.1.9.2","14","mutually beneficial cooperation. Ulam (<a"
"1.3.1.9.2","15","href=&quot;#Ref-16&quot;>16</a>)   has specifically recommended"
"1.3.1.9.2","16","close man-computer interaction in a chapter entitled,"
"1.3.1.9.2","17","&quot;synergesis,&quot; where he points out in considerable"
"1.3.1.9.2","18","detail the types of mathematical work which could be aided. Good"
"1.3.1.9.2","19","(<a href=&quot;#Ref-17&quot;>17</a>) includes some conjecture"
"1.3.1.9.2","20","about possibilities of intellectual aid to the human by close"
"1.3.1.9.2","21","cooperation with a computer in a rather general way, and also"
"1.3.1.9.2","22","presents a few interesting thoughts about a   network model for"
"1.3.1.9.2","23","structuring the conceptual kernels of   information to"
"1.3.1.9.2","24","facilitate a sort of self-organizing retrieval   system. Ramo"
"1.3.1.9.2","25","has given a number of talks dealing with the   future"
"1.3.1.9.2","26","possibilities of computers for &quot;extending man's"
"1.3.1.9.2","27","intellect,&quot; and wrote several articles (<a"
"1.3.1.9.2","28","href=&quot;#Ref-18&quot;>18</a>, <a"
"1.3.1.9.2","29","href=&quot;#Ref-19&quot;>19</a>) His   projections seem slanted"
"1.3.1.9.2","30","more toward larger bodies of humans   interacting with"
"1.3.1.9.2","31","computers, in less of an intimate personal sense than the above"
"1.3.1.9.2","32","papers or than our initial goal. Fein (<a"
"1.3.1.9.2","33","href=&quot;#Ref-20&quot;>20</a>) in making a comprehensive"
"1.3.1.9.2","34","projection of the growth and dynamic inter-relatedness of"
"1.3.1.9.2","35","&quot;computer-related sciences,&quot; includes specific mention"
"1.3.1.9.2","36","of the   enhancement of human intellect by cooperative activity"
"1.3.1.9.2","37","of men,   mechanisms, and automata. He coined the term"
"1.3.1.9.2","38","&quot;synnoetics&quot; as   applicable generally to the"
"1.3.1.9.2","39","cooperative interaction of people,   mechanisms, plant or animal"
"1.3.1.9.2","40","organisms, and automata into a   system whose mental power is"
"1.3.1.9.2","41","greater than that of its   components, and presented a good"
"1.3.1.9.2","42","picture of the integrated way   in which many currently separate"
"1.3.1.9.2","43","disciplines should be   developed and taught in the future to do"
"1.3.1.9.2","44","justice to their   mutual roles in the important metadiscipline"
"1.3.1.9.2","45","defined as   &quot;synnoetics.&quot;"
"1.3.1.9.3","1","In the second category, there have   been a few papers published"
"1.3.1.9.3","2","recently describing actual work   that bears directly upon our"
"1.3.1.9.3","3","topic. Licklider and Clark, (<a href=&quot;#Ref-21&quot;>21</a>)"
"1.3.1.9.3","4","and Culler and Huff, (<a href=&quot;#Ref-22&quot;>22</a>) in the"
"1.3.1.9.3","5","1962 Spring Joint Computer   Conference, gave what are"
"1.3.1.9.3","6","essentially progress reports of work   going on now in exactly"
"1.3.1.9.3","7","this sort of thing--a human with a   computer backed display"
"1.3.1.9.3","8","getting minute-by-minute help in   solving problems. Teager (<a"
"1.3.1.9.3","9","href=&quot;#Ref-23&quot;>23</a>, <a"
"1.3.1.9.3","10","href=&quot;#Ref-24&quot;>24</a>) reports on the plans and"
"1.3.1.9.3","11","current development of a large time-sharing system at MIT, which"
"1.3.1.9.3","12","is planned to provide direct computer access for a number of"
"1.3.1.9.3","13","outlying stations located in scientists' offices, giving each of"
"1.3.1.9.3","14","these users a chance for real-time utilization of the computer."
"1.3.1.9.4","1","There are several efforts that we   have heard about, but for"
"1.3.1.9.4","2","which there are either no   publications or for which none have"
"1.3.1.9.4","3","been discovered by us.   Mr. Douglas Ross, of the Electronic"
"1.3.1.9.4","4","Systems Laboratory at MIT   has, we learned by direct"
"1.3.1.9.4","5","conversation, been thinking and   working on real-time man-"
"1.3.1.9.4","6","machine interaction problems for some   years. We have recently"
"1.3.1.9.4","7","learned that a graduate student at   MIT, Glenn Randa, (<a"
"1.3.1.9.4","8","href=&quot;#Ref-25&quot;>25</a>) has   developed the design of a"
"1.3.1.9.4","9","remote display console under Ross   for his graduate thesis"
"1.3.1.9.4","10","project. We understand that another   graduate student there,"
"1.3.1.9.4","11","Ivan Sutherland, is currently using   the display-computer"
"1.3.1.9.4","12","facility on the TX-2 computer at Lincoln   Lab to develop"
"1.3.1.9.4","13","cooperative techniques for engineering-design   problems. And at"
"1.3.1.9.4","14","RAND, we have learned by personal discussion   that Cliff Shaw,"
"1.3.1.9.4","15","Tom Ellis, and Keith Uncapher have been   involved in"
"1.3.1.9.4","16","implementing a multi-station time-sharing system   built around"
"1.3.1.9.4","17","their JOHNNIAC computer.  Termed the JOHNNIAC   Open-Shop System"
"1.3.1.9.4","18","(JOSS for short), it apparently is near   completion, and will"
"1.3.1.9.4","19","use remote type writer stations."
"1.3.1.9.5","1","Undoubtedly, there are efforts of   others falling into either"
"1.3.1.9.5","2","or both categories that have been   overlooked. Such oversight"
"1.3.1.9.5","3","has not been intentional, and it is   hoped that these"
"1.3.1.9.5","4","researchers will make their pertinent work   known to us."
"1.3.2","1","B. HYPOTHETICAL DESCRIPTION OF COMPUTER-BASED AUGMENTATION"
"1.3.2","2","SYSTEM"
"1.3.2.1","1","Let us consider some specific possibilities for redesigning the"
"1.3.2.1","2","augmentation means for an intellectually oriented, problem-"
"1.3.2.1","3","solving human. We choose to present those developments of"
"1.3.2.1","4","language and methodology that can capitalize upon the symbol-"
"1.3.2.1","5","manipulating and portraying capabilities of computer-based"
"1.3.2.1","6","equipment. The picture of the possibilities to pursue will"
"1.3.2.1","7","change and grow rapidly as research gets under way, but we need"
"1.3.2.1","8","to provide what pictures we can--to give substance to the"
"1.3.2.1","9","generalities developed in Section II, to try to impart our"
"1.3.2.1","10","feeling of rich promise, and to introduce a possible research"
"1.3.2.1","11","program (Section IV)."
"1.3.2.2","1","Although our generalizations (about augmentation means,"
"1.3.2.2","2","capability hierarchies, and mental-, concept-, symbol-,"
"1.3.2.2","3","process-, and physical structuring) might retain their validity"
"1.3.2.2","4","in the future--for instance, our generalized prediction that new"
"1.3.2.2","5","developments in concept, symbol, and process structuring will"
"1.3.2.2","6","prove to be tremendously important--the specific concepts,"
"1.3.2.2","7","symbol structures, and processes that evolve will most likely"
"1.3.2.2","8","differ from what we know and use now. In fact, even if we in"
"1.3.2.2","9","some way could know now what would emerge after say, ten years"
"1.3.2.2","10","of research, it is likely that any but a general description"
"1.3.2.2","11","would be difficult to express in today's terminology."
"1.3.2.3","1","1. Background"
"1.3.2.3.1","1","To try to give you (the reader) a   specific sort of feel for"
"1.3.2.3.1","2","our thesis in spite of this   situation, we shall present the"
"1.3.2.3.1","3","following picture of   computer-based augmentation possibilities"
"1.3.2.3.1","4","by describing what   might happen if you were being given a"
"1.3.2.3.1","5","personal   discussion-demonstration by a friendly fellow (named"
"1.3.2.3.1","6","Joe) who   is a trained and experienced user of such an"
"1.3.2.3.1","7","augmentation   system within an experimental research program"
"1.3.2.3.1","8","which is   several years beyond our present stage. We assume"
"1.3.2.3.1","9","that you   approach this demonstration-interview with a"
"1.3.2.3.1","10","background   similar to what the previous portion of this report"
"1.3.2.3.1","11","provides--that is, you will have heard or read a set of"
"1.3.2.3.1","12","generalizations and a few rather primitive examples, but you"
"1.3.2.3.1","13","will not yet have been given much of a feel for how a"
"1.3.2.3.1","14","computer-based augmentation system can really help a   person."
"1.3.2.3.2","1","Joe understands this and explains   that he will do his best to"
"1.3.2.3.2","2","give you the valid conceptual feel   that you want--trying to"
"1.3.2.3.2","3","tread the narrow line between being   too detailed and losing"
"1.3.2.3.2","4","your over-all view anc being too   general and not providing you"
"1.3.2.3.2","5","with a solid feel for what goes   on. He suggests that you sit"
"1.3.2.3.2","6","and watch him for a while as he   pursues some typical work,"
"1.3.2.3.2","7","after which he will do some   explaining. You are not"
"1.3.2.3.2","8","particularly flattered by this, since   you know that he is just"
"1.3.2.3.2","9","going to be exercising new language   and methodology"
"1.3.2.3.2","10","developments on his new artifacts--and after   all, the"
"1.3.2.3.2","11","artifacts don't look a bit different from what you   expected--"
"1.3.2.3.2","12","so why should he keep you sitting there as if you   were a"
"1.3.2.3.2","13","complete stranger to this stuff? It will just be a   matter of"
"1.3.2.3.2","14","&quot;having the computer do some of his   symbol-manipulating"
"1.3.2.3.2","15","processes for him so that he can use more   powerful concepts"
"1.3.2.3.2","16","and concept-manipulation techniques,&quot; as you   have so"
"1.3.2.3.2","17","often been told."
"1.3.2.3.3","1","Joe has two display screens side by   side, but one of them he"
"1.3.2.3.3","2","doesn't seem to use as much as the   other. And the screens are"
"1.3.2.3.3","3","almost horizontal, more like the   surface of a drafting table"
"1.3.2.3.3","4","than the near-vertical picture   displays you had somehow"
"1.3.2.3.3","5","imagined. But you see the reason   easily, for he is working on"
"1.3.2.3.3","6","the display surface as intently   as a draftsman works on his"
"1.3.2.3.3","7","drawings, and it would be awkward   to reach out to a vertical"
"1.3.2.3.3","8","surface for this kind of work. Some   of the time Joe is using"
"1.3.2.3.3","9","both hands on the keys, obviously   feeding information into the"
"1.3.2.3.3","10","computer at a great rate."
"1.3.2.3.4","1","Another slight surprise, though--you   see that each hand"
"1.3.2.3.4","2","operates on a set of keys on its own side   of the display"
"1.3.2.3.4","3","frames, so that the hands are almost two feet   apart. But it is"
"1.3.2.3.4","4","plain that this arrangement allows him to   remain positioned"
"1.3.2.3.4","5","over the frames in a rather natural   position, so that when he"
"1.3.2.3.4","6","picks the light pen out of the air   (which is its rest"
"1.3.2.3.4","7","position, thanks to a system of jointed   supporting arms and a"
"1.3.2.3.4","8","controlled tension and rewind system for   the attached cord)"
"1.3.2.3.4","9","his hand is still on the way from the   keyset to the display"
"1.3.2.3.4","10","frame. When he is through with the pen   at the display frame,"
"1.3.2.3.4","11","he lets go of it, the cord rewinds, and   the pen is again in"
"1.3.2.3.4","12","position. There is thus a minimum of   effort, movement, and"
"1.3.2.3.4","13","time involved in turning to work on the   frame. That is, he"
"1.3.2.3.4","14","could easily shift back and forth from   using keyset to using"
"1.3.2.3.4","15","light pen, with either hand (one pen is   positioned for each"
"1.3.2.3.4","16","hand), without moving his head, turning,   or leaning."
"1.3.2.3.5","1","A good deal of Joe's time, though,   seems to be spent with one"
"1.3.2.3.5","2","hand on a keyset and the other   using a light pen on the"
"1.3.2.3.5","3","display surface. It is in this type   of working mode that the"
"1.3.2.3.5","4","images on the display frames changed   most dynamically. You"
"1.3.2.3.5","5","receive another real surprise as you   realize how much activity"
"1.3.2.3.5","6","there is on the face of these   display tubes. You ask yourself"
"1.3.2.3.5","7","why you weren't prepared for   this, and you are forced to admit"
"1.3.2.3.5","8","that the generalizations you   had heard hadn't really sunk"
"1.3.2.3.5","9","in--&quot;new methods for manipulating   symbols&quot; had been"
"1.3.2.3.5","10","an oft-repeated term, but it just hadn't   included for you the"
"1.3.2.3.5","11","images of the free and rapid way in which   Joe could make"
"1.3.2.3.5","12","changes in the display, and of meaningful and   flexible"
"1.3.2.3.5","13","&quot;shaping&quot; of ideas and work status which could take"
"1.3.2.3.5","14","place so rapidly."
"1.3.2.3.6","1","Then you realized that you couldn't   make any sense at all out"
"1.3.2.3.6","2","of the specific things he was doing,   nor of the major part of"
"1.3.2.3.6","3","what you saw on the displays. You   could recognize many words,"
"1.3.2.3.6","4","but there were a good number that   were obviously special"
"1.3.2.3.6","5","abbreviations of some sort. During the   times when a given"
"1.3.2.3.6","6","image or portion of an image remained un   changed long enough"
"1.3.2.3.6","7","for you to study it a bit, you rarely saw   anything that looked"
"1.3.2.3.6","8","llke a sentence as you were used to   seeing one. You were"
"1.3.2.3.6","9","beginning to gather that there were other   symbols mixed with"
"1.3.2.3.6","10","the words that might be part of a sentence,   and that the"
"1.3.2.3.6","11","different parts of what made a full-thought   statement (your"
"1.3.2.3.6","12","feeling about what a sentence is) were not   just laid out end"
"1.3.2.3.6","13","to end as you expected. But Joe suddenly   cleared the displays"
"1.3.2.3.6","14","and turned to you with a grin that   signalled the end of the"
"1.3.2.3.6","15","passive observation period, and also   that somehow told you"
"1.3.2.3.6","16","that he knew very well that you now knew   that you had needed"
"1.3.2.3.6","17","such a period to shake out some of your   limited images and to"
"1.3.2.3.6","18","really realize that a &quot;capability   hierarchy&quot; was a"
"1.3.2.3.6","19","rich and vital thing."
"1.3.2.3.7","1","&quot;I guess you noticed that I was using   unfamiliar notions,"
"1.3.2.3.7","2","symbols, and processes to go about doing   things that were even"
"1.3.2.3.7","3","more unfamiliar to you?&quot; You made a   non-committal nod--"
"1.3.2.3.7","4","you saw no reason to admit to him that you   hadn't even been"
"1.3.2.3.7","5","able to tell which of the things he had been   doing were to"
"1.3.2.3.7","6","cooperate with which other things--and he   continued. &quot;To"
"1.3.2.3.7","7","give you a feel for what goes on, I'm going to   start"
"1.3.2.3.7","8","discussing and demonstrating some of the very basic   operations"
"1.3.2.3.7","9","and notions I've been using. You've read the stuff   about"
"1.3.2.3.7","10","process and process-capability hierarchies, I'm sure. I   know"
"1.3.2.3.7","11","from past experience in explaining radical augmentation"
"1.3.2.3.7","12","systems to people that the new and powerful higher-level"
"1.3.2.3.7","13","capabilities that they are interested in--because basically"
"1.3.2.3.7","14","those are what we are all anxious to improve--can't really be"
"1.3.2.3.7","15","explained to them without first giving them some understanding"
"1.3.2.3.7","16","of the new and powerful capabilities upon which they are"
"1.3.2.3.7","17","built. This holds true right on down the line to the type of"
"1.3.2.3.7","18","low-level capability that is new and different to them all"
"1.3.2.3.7","19","right, but that they just wouldn't ordinarily see as being"
"1.3.2.3.7","20","'powerful.' And yet our systems wouldn't be anywhere near as"
"1.3.2.3.7","21","powerful without them, and a person's comprehension of the"
"1.3.2.3.7","22","system would be rather shallow if he didn't have some"
"1.3.2.3.7","23","understanding of these basic capabilities and of the"
"1.3.2.3.7","24","hierarchical structure built up from them to provide the"
"1.3.2.3.7","25","highest-level capabilities.&quot;"
"1.3.2.4","1","2. Single-Frame Composition"
"1.3.2.4.1","1","&quot;For explanation purposes here, let's   say that the lowest"
"1.3.2.4.1","2","level at which the computer system comes   into direct play in"
"1.3.2.4.1","3","my capability hierarchy is in the task of   what I'll call"
"1.3.2.4.1","4","'single-frame composition.' We'll stick to   working with prose"
"1.3.2.4.1","5","text in our examples--most people can grasp   easily enough what"
"1.3.2.4.1","6","we are doing there without having to have   special backgrounds"
"1.3.2.4.1","7","in mathematics or science as they would to   gain equal"
"1.3.2.4.1","8","comprehension for some of the similar sorts of   things we do"
"1.3.2.4.1","9","with diagrams and mathematical equations. This   low-level"
"1.3.2.4.1","10","composition task is just what you normally do with a   pen or"
"1.3.2.4.1","11","pencil or typewriter on a piece of paper-- that is,   assemble a"
"1.3.2.4.1","12","bunch of symbols before your eyes in order to   portray"
"1.3.2.4.1","13","something which you have in mind.&quot;"
"1.3.2.4.2","1","You listened and watched as Joe   showed you some of the"
"1.3.2.4.2","2","different ways in which the composition   of straightforward"
"1.3.2.4.2","3","text was made easier for him in this   system. With either hand,"
"1.3.2.4.2","4","Joe could &quot;type&quot; (the keysets didn't   look at all"
"1.3.2.4.2","5","like typewriter keyboards) individual letters and   numbers, and"
"1.3.2.4.2","6","if he had directed it to do so, the computer   would put each"
"1.3.2.4.2","7","successive symbol next to its predecessor just   as a typewriter"
"1.3.2.4.2","8","does--only here there was completely automatic   &quot;carriage"
"1.3.2.4.2","9","return&quot; service. This didn't impress you very much,   since"
"1.3.2.4.2","10","an automatic carriage-return feature was sort of a   trivial"
"1.3.2.4.2","11","return on the investment behind all of this   equipment--but"
"1.3.2.4.2","12","then you reflected that, as long as the   computer was there"
"1.3.2.4.2","13","anyway, to help do all the flashy things   you had witnessed"
"1.3.2.4.2","14","earlier, one might as well use it in all of   the little helpful"
"1.3.2.4.2","15","ways he could."
"1.3.2.4.3","1","But there were other ways in which   help was derived for this"
"1.3.2.4.3","2","composition task. He showed you how   he could call up the"
"1.3.2.4.3","3","dictionary definition to any word he had   typed in, with but a"
"1.3.2.4.3","4","few quick flicks on the keyset. Synonyms   or antonyms could"
"1.3.2.4.3","5","just as easily be brought forth. This also   seemed sort of"
"1.3.2.4.3","6","trivially obvious, and Joe seemed to know that   you would feel"
"1.3.2.4.3","7","so. &quot;It turns out that this simple capability   makes it"
"1.3.2.4.3","8","feasible to do some pretty rough tasks in the upper   levels of"
"1.3.2.4.3","9","the capability hierarchy--where precise use of   special terms"
"1.3.2.4.3","10","really pays off, where the human just couldn't   be that precise"
"1.3.2.4.3","11","by depending upon his unaided memory for   definitions and"
"1.3.2.4.3","12","'standards,' and where using dictionary and   reference-book"
"1.3.2.4.3","13","lookup in the normal fashion would be so   distracting and time-"
"1.3.2.4.3","14","consuming that the task execution would   break down. We've"
"1.3.2.4.3","15","tried taking this feature away in some of   these processes up"
"1.3.2.4.3","16","there, and believe me, the result was a   mess."
"1.3.2.4.4","1","You could get some dim feeling for   what he meant, having"
"1.3.2.4.4","2","watched him working for a while, but you   were nevertheless"
"1.3.2.4.4","3","much relieved to find the next thing he   showed you to be more"
"1.3.2.4.4","4","directly impressive. He showed you how   he could single out a"
"1.3.2.4.4","5","group of words (called the &quot;object   symbol string,&quot;"
"1.3.2.4.4","6","or simply &quot;object string&quot;) and define an"
"1.3.2.4.4","7","abbreviation term, composed of any string of symbols he might"
"1.3.2.4.4","8","choose, that became associated with the object string in"
"1.3.2.4.4","9","computer storage. At any later time (until he chose to discard"
"1.3.2.4.4","10","that particular abbreviation from his working voca bulary) the"
"1.3.2.4.4","11","typing of the abbreviation term would call forth automatically"
"1.3.2.4.4","12","the &quot;printing&quot; on the display of the entire object"
"1.3.2.4.4","13","string. Joe   showed you another way in which this abbreviation"
"1.3.2.4.4","14","feature   might work. He &quot;arranged&quot; for the computer"
"1.3.2.4.4","15","to print the   abbreviation on the display, just the way he"
"1.3.2.4.4","16","typed it in. At a   subsequent reading, if he had for gotten"
"1.3.2.4.4","17","what the abbreviation   stood for, he could call for"
